{
  "$schema": "http://json-schema.org/draft-07/schema#", "$id": "https://agent-flow.invalid/contracts/v1/eval-result.schema.json", "title": "EvalResult 1.0", "type": "object", "additionalProperties": false,
  "required": ["schema_version", "experiment_id", "trial_id", "run_id", "task_ref", "config_hash", "dataset_version", "grader_version", "status", "task_success", "first_pass_success", "human_review_minutes", "rework", "tool_calls", "tokens", "duration_seconds", "estimated_cost", "gates", "post_acceptance_defects", "artifact_refs"],
  "properties": {"schema_version": {"const": "1.0"}, "experiment_id": {"type": "string", "minLength": 1}, "trial_id": {"type": "string", "minLength": 1}, "run_id": {"$ref": "#/definitions/id"}, "task_ref": {"$ref": "#/definitions/task_ref"}, "config_hash": {"$ref": "#/definitions/hash"}, "dataset_version": {"type": "string", "minLength": 1}, "grader_version": {"type": "string", "minLength": 1}, "status": {"enum": ["success", "failure", "error", "skipped"]}, "task_success": {"type": ["boolean", "null"]}, "first_pass_success": {"type": ["boolean", "null"]}, "human_review_minutes": {"type": ["number", "null"], "minimum": 0}, "rework": {"type": "object", "additionalProperties": false, "required": ["iterations", "minutes"], "properties": {"iterations": {"type": ["integer", "null"], "minimum": 0}, "minutes": {"type": ["number", "null"], "minimum": 0}}}, "tool_calls": {"type": ["integer", "null"], "minimum": 0}, "tokens": {"type": "object", "additionalProperties": false, "required": ["input", "output"], "properties": {"input": {"type": ["integer", "null"], "minimum": 0}, "output": {"type": ["integer", "null"], "minimum": 0}}}, "duration_seconds": {"type": ["number", "null"], "minimum": 0}, "estimated_cost": {"type": "object", "additionalProperties": false, "required": ["usd", "pricing_ref"], "properties": {"usd": {"type": ["number", "null"], "minimum": 0}, "pricing_ref": {"type": ["string", "null"], "minLength": 1}}}, "gates": {"type": "array", "items": {"$ref": "gate-result.schema.json"}}, "post_acceptance_defects": {"type": "object", "additionalProperties": false, "required": ["count", "window_end", "issue_refs"], "properties": {"count": {"type": ["integer", "null"], "minimum": 0}, "window_end": {"type": ["string", "null"], "format": "date-time", "pattern": "^\\d{4}-\\d{2}-\\d{2}T\\d{2}:\\d{2}:\\d{2}(?:\\.\\d+)?Z(?![\\s\\S])"}, "issue_refs": {"type": "array", "items": {"type": "string", "minLength": 1}}}}, "artifact_refs": {"type": "array", "items": {"type": "string", "minLength": 1}}, "extensions": {"type": "object"}},
  "definitions": {"id": {"type": "string", "pattern": "^[A-Za-z0-9][A-Za-z0-9_.-]{0,127}(?![\\s\\S])"}, "hash": {"type": "string", "pattern": "^[0-9a-f]{64}(?![\\s\\S])"}, "task_ref": {"type": "object", "additionalProperties": false, "required": ["id", "revision", "sha256"], "properties": {"id": {"$ref": "#/definitions/id"}, "revision": {"$ref": "#/definitions/id"}, "sha256": {"$ref": "#/definitions/hash"}}}}
}
