{"schema_version":"1.0","experiment_id":"exp-1","trial_id":"trial-1","run_id":"run-1","task_ref":{"id":"task-1","revision":"r1","sha256":"aaaaaaaaaaaaaaaaaaaaaaaaaaaaaaaaaaaaaaaaaaaaaaaaaaaaaaaaaaaaaaaa"},"config_hash":"aaaaaaaaaaaaaaaaaaaaaaaaaaaaaaaaaaaaaaaaaaaaaaaaaaaaaaaaaaaaaaaa","dataset_version":"1","grader_version":"1","status":"skipped","task_success":null,"first_pass_success":null,"human_review_minutes":null,"rework":{"iterations":null,"minutes":null},"tool_calls":null,"tokens":{"input":null,"output":null},"duration_seconds":null,"estimated_cost":{"usd":null,"pricing_ref":null},"gates":[],"post_acceptance_defects":{"count":null,"window_end":null,"issue_refs":[]},"artifact_refs":[]}
