{"schema_version":"1.0","experiment_id":"exp-2","trial_id":"trial-2","run_id":"run-2","task_ref":{"id":"task-2","revision":"r2","sha256":"bbbbbbbbbbbbbbbbbbbbbbbbbbbbbbbbbbbbbbbbbbbbbbbbbbbbbbbbbbbbbbbb"},"config_hash":"bbbbbbbbbbbbbbbbbbbbbbbbbbbbbbbbbbbbbbbbbbbbbbbbbbbbbbbbbbbbbbbb","dataset_version":"1","grader_version":"1","status":"success","task_success":true,"first_pass_success":false,"human_review_minutes":0,"rework":{"iterations":0,"minutes":0},"tool_calls":0,"tokens":{"input":0,"output":0},"duration_seconds":0,"estimated_cost":{"usd":0,"pricing_ref":"pricing://v1"},"gates":[{"schema_version":"1.0","gate_id":"gate-1","run_id":"run-2","category":"test","required":true,"status":"pass","reason_code":"ok","duration_seconds":0,"exit_code":0,"evidence_refs":[],"checker_version":"1","input_digest":"bbbbbbbbbbbbbbbbbbbbbbbbbbbbbbbbbbbbbbbbbbbbbbbbbbbbbbbbbbbbbbbb"}],"post_acceptance_defects":{"count":0,"window_end":"2026-09-18T00:00:00Z","issue_refs":["issue://1"]},"artifact_refs":["artifact://eval/2"],"extensions":{"note":"informative"}}
